movieId,title,genres,actors,directors,posterPath,plotSummary,releaseDate,languages,runtime
103384,The Lone Ranger,"Action,Adventure,Western","Johnny Depp,Armie Hammer,William Fichtner,Helena Bonham Carter,James Badge Dale,Tom Wilkinson,Ruth Wilson,Barry Pepper,James Frain,Mason Cook,Matt O'Leary,Leon Rippy,Harry Treadaway,Damon Herriman,W. Earl Brown,Gil Birmingham,Saginaw Grant,Stephen Brodie,Matthew Page,Nick W. Nicholson,Bryant Prince,JD Cullum,Joaquín Cosio,Timothy V. Murphy,Damon Carney,Kevin Wiggins,Chad Brummett,Robert Baker,Lew Temple,Stephen Root,Randy Oglesby,Brad Greenquist,Rance Howard,Leonard Earl Howze,Travis Hammer,Steve Corona,Jack Axelrod,Christopher Hagen,Freda Foh Shen,Margaret Bowman,Luz P. Mendez,Laina Loucks,Devon J. Adams,Desirae Anslover,Charlotte Cormier,Megan Pribyl,Briana Van Schuyver,Julie Stracener,Chad Randall,Jason E. Hill,Beth Bailey,Joanne Camp,Bob Rumnock,Tait Fletcher,Alex Knight,Argos MacCallum,Pokey Lafarge,Joey Glynn,Adam Hoskins,Ryan Koenig",Gore Verbinski,/b4vil5ueYJNBNypHmo1tpuevh4z.jpg,"The Texas Rangers chase down a gang of outlaws led by Butch Cavendish, but the gang ambushes the Rangers, seemingly killing them all. One survivor is found, however, by an American Indian named Tonto, who nurses him back to health. The Ranger, donning a mask and riding a white stallion named Silver, teams up with Tonto to bring the unscrupulous gang and others of that ilk to justice.",2013-07-03,English,149
110730,Transcendence,"Thriller,Science Fiction,Drama,Mystery","Johnny Depp,Paul Bettany,Rebecca Hall,Kate Mara,Morgan Freeman,Cillian Murphy,Cole Hauser,Clifton Collins Jr,Falk Hentschel,Kristen Rakes,Cory Hardrict,Josh Stewart,Luce Rains,Fernando Chien,Steven Liu,Xander Berkeley,Lukas Haas,Wallace Langham,James Burnett,Sam Quinn,Sam Webb,Chris Gartin,Olivia Taylor Dudley,Abe Martell,Lauren Sivan,Laramie Cooley,Nancy Jeris,Colin Jones,Dylan Kenin,Chad Brummett,Antonio Del Prete,Jon Kristian Moore,John Trejo,Darren P. Leis,Richard Daniel Williams,Seth Adkins,Jaime Powers,Lubella Gauna,Lyn Quinn,Kendra Tuthill,Darrick Hurst",Wally Pfister,/4eESVBvr7KEvPGUZVL5LDWsANda.jpg,"Two leading computer scientists work toward their goal of Technological Singularity,  as a radical anti-technology organization fights to prevent them from creating a world where computers can transcend the abilities of the human brain.",2014-04-16,English,119
122896,Pirates of the Caribbean: Dead Men Tell No Tales,"Adventure,Action,Fantasy,Comedy","Johnny Depp,Javier Bardem,Geoffrey Rush,Brenton Thwaites,Kaya Scodelario,Kevin McNally,Stephen Graham,David Wenham,Golshifteh Farahani,Orlando Bloom,Martin Klebba,Angus Barnett,Adam Brown,Danny Kirrane,Giles New,Delroy Atkinson,Paul McCartney,Keira Knightley,Anthony De La Torre,Lewis McGowan,Juan Carlos Vellido,Rodney Afif,Bruce Spence,Zoe Ventoura,James Mackay,Brooke Chamberlain,Alexander Scheer,Goran D. Kleut,Wassim Hawat,Ben O'Toole,Finn Ireland,Nico Cortez,James Fraser,Derani Scarr,Robert Morgan,Goran D. Kleut,Mahesh Jadu,Travis Jeffery,Akos Armont,Sean Lynch,Ben O'Toole,Akshay Caplash,Rafael Torrijos,Mivon Prince-Leyva,Michael Dorman,Rohan Nichol,Rupert Raineri,Stephen Lopez,Richard Piper,Justin Smith,John Leary,Bryan Probets,Ken Radley,Hannah Walters,Jonathan Elsom,K. Todd Freeman,James Lawson,Darcy Laurie,Jessica Green,Haley Madison,Kiara Freeman,Piper Nairn,Suzanne Dervish-Ali,Donnie Baxter,Winnie Mzembe,Christie-Lee Britten,Mollie McGregor,Sophia McGregor","Joachim Rønning,Espen Sandberg",/xbpSDU3p7YUGlu9Mr6Egg2Vweto.jpg,"Thrust into an all-new adventure, a down-on-his-luck Capt. Jack Sparrow feels the winds of ill-fortune blowing even more strongly when deadly ghost sailors led by his old nemesis, the evil Capt. Salazar, escape from the Devil's Triangle. Jack's only hope of survival lies in seeking out the legendary Trident of Poseidon, but to find it, he must forge an uneasy alliance with a brilliant and beautiful astronomer and a headstrong young man in the British navy.",2017-05-23,English,129
125914,Mortdecai,"Comedy,Adventure","Johnny Depp,Gwyneth Paltrow,Ewan McGregor,Paul Bettany,Olivia Munn,Jeff Goldblum,Jonny Pasvolsky,Michael Culkin,Ulrich Thomsen,Alec Utgoff,Guy Burnet,Chris Bearne,Jamie Bernadette,Stephen Farrelly",David Koepp,/56rS3ipzekH2VlHpnH8VOTkKjwR.jpg,"Art dealer, Charles Mortdecai, searches for a stolen painting rumored to contain a secret code that gains access to hidden Nazi gold.",2015-01-21,English,106
136018,Black Mass,Thriller,"Johnny Depp,Joel Edgerton,Benedict Cumberbatch,Dakota Johnson,Kevin Bacon,Peter Sarsgaard,Jesse Plemons,David Harbour,Adam Scott,Corey Stoll,Julianne Nicholson,W. Earl Brown,Bill Camp,Juno Temple,Mark Mahoney,Brad Carter,Scott G. Anderson,Lonnie Farmer,Mary Klug,Erica McDermott,Luke Ryan,Owen Burke,Lewis D. Wheeler,Billy Meleady,Jamie Donnelly,David De Beck,Gary Galone,Rory Cochrane,James Russo,Jeremy Strong,Danae Nason,Bretton Manley,Berglind Jonsdottir,Robert Walsh,David Conley,Ciaran Crawford,Thomas Philip O'Neill,Joey Vacchio,Bill Haims,Anthony Molinari,Todd Ryan Jones,Declan Mulvey,Bates Wilder,Marc Carver,Richard Donelly,Brian A. White,Peter Morse,Tom Kemp,Patrick M. Walsh,Naheem Garcia,Kathryn A. Beauchamp,Stephen Curran,Darin X.L. MacEachern,Cary 'Big Shug' Guy,Sean Malone,Jack Neary,Jimmy Joe Maher,Forry Buckingham,Danny DeMiller,Michael F. Murphy,Alexander Cook,Ava Cooper,Stella Cooper,Amanda Blattner,Julie Ann Dawson",Scott Cooper,/yIVnNriiyl522hk3LFLJrrMovhP.jpg,"The true story of Whitey Bulger, the brother of a state senator and the most infamous violent criminal in the history of South Boston, who became an FBI informant to take down a Mafia family invading his turf.",2015-09-04,English,122
158813,Alice Through the Looking Glass,"Adventure,Family,Fantasy","Johnny Depp,Mia Wasikowska,Anne Hathaway,Helena Bonham Carter,Alan Rickman,Michael Sheen,Sacha Baron Cohen,Andrew Scott,Toby Jones,Rhys Ifans,Timothy Spall,Ed Speleers,Stephen Fry,Lindsay Duncan,Matt Lucas,Tom Godwin,Richard Armitage,Amelia Crouch,Leilah de Meza,Geraldine James,Leo Bill,Barbara Windsor,Meera Syal,Hattie Morahan,Simone Kirby,Siobhan Redmond,Frances de la Tour,Paul Whitehouse,Michael Sheen,Matt Vogel,Paul Hunter,Wally Wingert,Louis Ashbourne Serkis,Joanna Bobin,Joe Hurst,Oliver Hawkes,Frederick Warder,Eve Hedderwick Turner,Daniel Hoffmann-Gill,Jamie Baughan,Matt Wilman,Siobhan McSweeney,Owain Rhys Davies,Edward Petherbridge,Richard Syms,Neil Edmond,Bill Thomas,Carol Been,Ross Carpenter,Melissa Collier,Heather Craig,Janine Craig,Leigh Daniels,Jules Davison,Matt Dempsey,Nikki Dunsford,Stephanie Elstob,Steve Fortune,Jane Fowler,Adam Galbraith,Chris Grierson,Dale Mercer,William Mowat,Cris Penfold,Kraig Thornber,Carl Walker,Claire Winsper,Freddie Andrews,Isaac Andrews,Lasco Atkins,Lauren Beacham,Alexander Bracq,Austin Burrows,Adam Burton,Sarah Butterworth,Yue Ting Cheng,Frances de la Tour,Angela Dee,Karl Farrer,Wayne Gibbon,Ross Green,Jacob Greener-Tofts,Kyle Hebert,Matt Hookings,Bomber Hurley-Smith,Mark Jury,Minouche Kaftel,Martyn Mayger,Alida Pantone,Alexander James Rodriguez,Riku Rokkanen,Steve Saunders,Mike Simmrin,Karol Steele,Daniel Westwood,Tom Whelehan,Christian Wolf-La'Moy ,Charlotte Worwood",James Bobin,/7rfucKCjV01OEsGr9grXa34Aywd.jpg,"In the sequel to Tim Burton's ""Alice in Wonderland"", Alice Kingsleigh returns to Underland and faces a new adventure in saving the Mad Hatter.",2016-05-25,English,113
161920,Donald Trump's The Art of the Deal: The Movie,Comedy,"Johnny Depp,Ron Howard,Alfred Molina,Robert Morse,Patton Oswalt,Jack McBrayer,Michaela Watkins,Henry Winkler,Stephen Merchant,Christopher Lloyd,Kristen Schaal,Andy Richter,Paul Scheer,Rob Huebel,Jason Mantzoukas,Tymberlee Hill,Emjay Anthony,Albert Tsai,Sayeed Shahidi,Jacob Tremblay,Ron Funches",Jeremy Konner,/eWUtmqIzdHMxWg61OvuS5Sv8Ghx.jpg,"Donald Trump has it all. Money, power, respect, and an Eastern European bride. But all his success didn’t come for nothing. First, he inherited millions of dollars from his rich father, then he grabbed New York City by the balls. Now you can learn the art of negotiation, real estate, and high-quality brass in this illuminating made-for-TV special feature, Funny Or Die Presents Donald Trump’s The Art Of The Deal: The Movie.",2016-02-10,English,50
184865,Sherlock Gnomes,"Romance,Animation,Comedy,Family,Fantasy,Mystery,Adventure","Johnny Depp,Emily Blunt,James McAvoy,Chiwetel Ejiofor,Mary J. Blige,Stephen Merchant,Michael Caine,Dexter Fletcher,James Hong,Ashley Jensen,Matt Lucas,Ozzy Osbourne,Maggie Smith,Julie Walters,Jamie Demetriou,Richard Wilson,Kelly Asbury",John Stevenson,/xHdf2wRgCSp9MrZRryikiZIH6jB.jpg,"Garden gnomes, Gnomeo & Juliet, recruit renown detective, Sherlock Gnomes, to investigate the mysterious disappearance of other garden ornaments.",2018-03-15,English,86
191491,City of Lies,"Crime,Thriller","Johnny Depp,Forest Whitaker,Toby Huss,Dayton Callie,Neil Brown Jr.,Shea Whigham,Xander Berkeley,Melanie Benz,Shamier Anderson,Laurence Mason,Christian George,Michael Paré,Amin Joseph,Josh Hardwick,Glenn Plummer",Brad Furman,/15ubD2qDAJgJrBjk4sy5cD2YiYd.jpg,The murders of Tupac Shakur and Notorious BIG spark an investigation.,2018-09-07,English,0
