movieId,title,genres,actors,directors,posterPath,plotSummary,releaseDate,languages,runtime
6422,Shenandoah,"Action,Adventure,Drama,Western","James Stewart,Doug McClure,Glenn Corbett,Patrick Wayne,Rosemary Forsyth,Phillip Alford,Katharine Ross,Jim McMullan,Tim McIntire,Gene Jackson,Paul Fix,Denver Pyle,George Kennedy,James Best,Charles Robinson",Andrew V. McLaglen,/5nzMHdHrzdRuHWzTT8gHxvKvq19.jpg,"Charlie Anderson, a farmer in Shenandoah, Virginia, finds himself and his family in the middle of the Civil War he wants nothing to do with. When his youngest boy is taken prisoner by the North the Civil War is forced upon him.",1965-06-03,English,105
150208,Passage Home,Drama,"Anthony Steel,Peter Finch,Diane Cilento,Cyril Cusack,Geoffrey Keen,Hugh Griffith,Duncan Lamont,Gordon Jackson,Patrick McGoohan,Bryan Forbes,Michael Craig,Robert Brown,Martin Benson,Michael Bryant,Sam Kydd,Glyn Houston,Patrick Westwood,George Woodbridge,John Warren,Ian Whittaker,Scott Harrold,Arthur Lovegrove,Leonard White,Gerald Anderson,Philip Ray,Jim O'Brady",Roy Ward Baker,/vjrwFio4qv2xjdRUyHOcuW0PHmf.jpg,"Set in 1931, the film takes place aboard a merchant ship, briefly harboured in South America. A young woman (Diane Cilento) boards the ship as a passenger, resulting in disharmony among the superstitious crew members. Virtuous seaman Anthony Steel protects the girl from the lecherous advances of captain Peter Finch.",1955-03-17,English,102
160030,Goliath and the Sins of Babylon,Adventure,"Mark Forest,José Greci,Giuliano Gemma,Erno Crisa,Mimmo Palmara,Livio Lorenzon,Piero Lulli,Paul Müller,Eleonora Bianchi,Jacques Herlin,Alfio Caltabiano,Arnaldo Fabrizio,Ugo Sasso,Harold Bradley,Calisto Calisti,Nello Pazzafini,Loris Loddi,Emilio Messina",Michele Lupo,/q4wZrjzAvmmDdcUnYev8g9y1DJ4.jpg,Goliath battles for the freedom of the Babylonian people.,1963-12-03,"English,Italiano",92
163408,Martin's Day,,"Richard Harris,Lindsay Wagner,James Coburn,Justin Henry,Karen Black,John Ireland,Saul Rubinek,R. H. Thomson",Alan Gibson,/hvyAUe76JXGgj8z5Oa8qE435B2u.jpg,"Threatened with recapture after a prison escape, Martin Stechert grabs a 12-year-old as hostage. He proves to be named Martin, too a quiet ""good little boy"" always obeying the rules, whom life has given only dismal loneliness and frustration in return. Soon he begins to admire ""Stech"" for his cheeky pranks against society and his desperate mission to make dreams come true. In a climactic moment, he chooses to stay with the man even though he could run away. Via hijacks and hijinx, they flee to the idyllic peace of the older Martin's childhood home, a cabin on a lake. But the police are close behind, impatient and trigger-happy.",1985-02-22,English,98
125481,In Cold Blood,"Crime,TV Movie","Anthony Edwards,Eric Roberts,Sam Neill,Kevin Tighe",Jonathan Kaplan,/iMOsUS0gcdl9PX1nppstTxnDKJo.jpg,"At the end of the 1950s, in a more innocent America, the brutal, meaningless slaying of a Midwestern family horrified the nation. This film is based on Truman Capote's hauntingly detailed, psychologically penetrating nonfiction novel. While in prison, Dick Hickock, 20, hears a cell-mate's story about $10,000 in cash kept in a home safe by a prosperous rancher. When he's paroled, Dick persuades ex-con Perry Smith, also 20, to join him in going after the stash. On a November night in 1959, Dick and Perry break into the Holcomb, Kansas, house of Herb Clutter. Enraged at finding no safe, they wake the sleeping family and brutally kill them all. The bodies are found by two friends who come by before Sunday church. The murders shock the small Great Plains town, where doors are routinely left unlocked. Detective Alvin Dewey of the Kansas Bureau of Investigation heads the case, but there are no clues, no apparent motive and no suspects...",1996-11-24,"English,Deutsch",240
37335,Come Drink with Me,"Adventure,Action","Cheng Pei-Pei,Elliot Ngok,Chen Hung-Lieh,Yuen Siu-Tin,Jackie Chan,Mars,Lee Wan-Chung,Yeung Chi-Hing,Shum Lo,Ku Feng,Han Ying-Chieh,Fung Ngai,Hao Li-Jen,Violet Pan Ying-Zi,Lily Li Li-Li,Chin Chun",King Hu,/zttTrq6GGGnsf3TiddlHX6SQJ9y.jpg,"Cheng Pei-pei plays Golden Swallow, a fighter-for-hire who has been contracted by the local government to retrieve the governor's kidnapped son. Holding him is a group of rebels who are demanding that their leader be released from prison in return for the captured son. After a brief encounter with the gang at a local restaurant, Golden Swallow is joined by an inebriated wanderer Drunken Cat (Yueh Hua) who aids her in her mission.",1966-04-07,普通话,91
3554,Love & Basketball,"Action,Comedy,Drama,Romance","Chris Warren, Jr.,Kyla Pratt,Sanaa Lathan,Omar Epps,Alfre Woodard,Regina Hall,Glenndon Chatman,Jess Willard,Naykia Harris,Harry Lennix,Debbi Morgan,Dennis Haysbert,Al Foster,Colleen Matsuhara,Gabrielle Union,Tyra Banks,Christine Dunford,Boris Kodjoe,Erika Ringor,Monica Calhoun",Gina Prince-Bythewood,/zNZWNX19FZ5QyedprVM0ldsXFiP.jpg,"A young African-American couple navigates the tricky paths of romance and athletics in this drama. Quincy McCall (Omar Epps) and Monica Wright (Sanaa Lathan) grew up in the same neighborhood and have known each other since childhood. As they grow into adulthood, they fall in love, but they also share another all-consuming passion: basketball. They've followed the game all their lives and have no small amount of talent on the court. As Quincy and Monica struggle to make their relationship work, they follow separate career paths though high school and college basketball and, they hope, into stardom in big-league professional ball.",2000-04-21,"English,Español",124
175833,Final Justice,"Action,Comedy,Crime","Stephen Chow,James Ha,Ken Lo,William Ho Ka-Kui,Kwong Leung Wong,Fan Wei Yee,Shing Fui-On",Parkman Wong,/l1WTRPjhvazpuH5EAlERhQ0jiqY.jpg,"A cop relies on a young car thief to take down four gangsters, who plan to rob a rich merchant for a large amount of money.",1988-06-23,"广州话 / 廣州話,English",95
3060,The Commitments,"Comedy,Drama,Music","Robert Arkins,Michael Aherne,Angeline Ball,Maria Doyle Kennedy,Dave Finnegan,Bronagh Gallagher,Glen Hansard,Félim Gormley,Johnny  Murphy,Dick Massey,Colm Meaney,Ken McCluskey,Anne Kent,Ger Ryan,Andrew Strong,Andrea Corr,Gerard Cassoni,Liam Carney,Mark O'Regan,Phelim Drew,John Cronin,Sean Hughes,Sean Hughes",Alan Parker,/5d5lxBhrvU77X3SleY4DcQxiSPp.jpg,"Jimmy Rabbitte, just a tick out of school, gets a brilliant idea: to put a soul band together in Barrytown, his slum home in north Dublin. First he needs musicians and singers: things slowly start to click when he finds three fine-voiced females virtually in his back yard, a lead singer (Deco) at a wedding, and, responding to his ad, an aging trumpet player, Joey ""The Lips"" Fagan.",1991-08-14,"English,Gaeilge",118
129824,Buffalo Rider,"Adventure,Western","John Freeman,C. Lindsay Workman,Rick Guinn,Rich Scheeland","George Lauris,John Fabian,Dick Robinson",/ibbbpoerBAGJ0Xv7d43CO8fSNCU.jpg,In the 1800s Jake Jones finds a buffalo about to be eaten by coyotes. He rescues the buffalo and raises it. He names him Samson. Jones decides to break the buffalo and saddle him. He then becomes the guy ON A buffalo,1978-03-03,English,90
189691,My Brother's Keeper,"Drama,TV Movie","John Lithgow,Annette O'Toole,Veronica Cartwright,Zeljko Ivanek,Richard Masur,Brian Doyle-Murray,Amy Aquino,Peter Michael Goetz,Ellen Burstyn",Glenn A. Jordan,/oDXpV1tmwmikcEKpBYSJ5AHxF90.jpg,A man and his HIV-positive twin take an insurance company to court over a possibly life-saving bone marrow transplant.,1995-03-14,,94
132222,Frankenstein 1970,"Horror,Science Fiction","Boris Karloff,Tom Duggan,Jana Lund,Don Barry,Charlotte Austin,Irwin Berke,Rudolph Anders,John Dennis,Norbert Schiller,Mike Lane,Franz Roehn,Joe Ploski",Howard W. Koch,/mKbvZDkIqY4rk67iITuLsH9lMK.jpg,The baron's grandson rents the family castle to a TV crew to fund his atomic revival of the family monster.,1958-07-20,English,83
