movieId,title,genres,actors,directors,posterPath,plotSummary,releaseDate,languages,runtime
27431,The Adversary,"Mystery,Drama,Crime","Daniel Auteuil,Géraldine Pailhas,François Cluzet,François Berléand,Emanuelle Devos",Nicole Garcia,/z3YXbqALE1DdPlMW058rKHxOrl2.jpg,"Based on the 2000 book of the same name by Emmanuel Carrère, it is inspired by the real-life story of Jean-Claude Romand. L'Adversaire's protagonist Jean-Marc Faure (Auteuil) pursues an imaginary career as a doctor of medicine in a plot more closely based on Romand's life and Carrère's book than was Laurent Cantet's 2001 film L'Emploi du Temps. The film was nominated for a Palme d'Or at the 2002 Cannes Film Festival.",2002-08-28,Français,129
114436,The World of Kanako,"Mystery,Drama,Crime,Horror","Koji Yakusho,Nana Komatsu,Hiroya Shimizu,Satoshi Tsumabuki,Ai Hashimoto,Fumi Nikaido,Joe Odagiri,Aoi Morikawa,Mahiro Takasugi,Jun Kunimura,Asuka Kurosawa,Munetaka Aoki,Miki Nakatani,Megumi Hatachiya,Shono Hayama,Hiroki Nakajima",Tetsuya Nakashima,/JQLiPP0W9MM2eDRuCwvustT4SZ.jpg,"Showa Fujishima is a former detective. One day, his daughter Kanako, who is a model student, disappears. To find his daughter, he investigates more carefully into his daughter's life. He quickly realizes that his daughter is no saint, but there is nowhere he won't go to find her.",2014-07-04,日本語,118
26875,A Pure Formality,"Mystery,Drama,Crime,Thriller","Gérard Depardieu,Roman Polanski,Sergio Rubini,Nicola Di Pinto,Tano Cimarosa,Paolo Lombardi,Maria Rosa Spagnolo,Alberto Sironi,Giovanni Morricone,Mahdi Kraiem,Massimo Vanni,Sebastiano Filocamo",Giuseppe Tornatore,/iJSZAvg6VYJxaTfVZMhzI8jMnSD.jpg,"Onoff (Depardieu,) is a famous writer, now a recluse. The Inspector (Polanski,) is suspicious when Onoff is brought into the station one night, disoriented and suffering a kind of amnesia. In an isolated, rural police station, the Inspector tries to establish the events surrounding a killing, to reach a startling resolution.",1994-05-15,"Italiano,Français",108
60941,The Midnight Meat Train,"Mystery,Drama,Crime,Thriller,Horror","Bradley Cooper,Vinnie Jones,Brooke Shields,Leslie Bibb,Roger Bart,Ted Raimi,Peter Jacobson,Barbara Eve Harris,Stephanie Mace,Tony Curran,Quinton Jackson",Ryûhei Kitamura,/vHKe4D9qGK56OfgX9v5KnjXVMBE.jpg,"The photographer Leon lives with his girlfriend and waitress Maya waiting for a chance to get in the photo business. When Maya contacts their friend Jurgis, he schedules a meeting for Leon with the successful owner of arts gallery Susan Hoff; she analyzes Leon's work and asks him to improve the quality of his photos. During the night, the upset Leon decides to wander on the streets taking pictures with his camera, and he follows three punks down to the subway station; when the gang attacks a young woman, Leon defends her and the guys move on. On the next morning, Leon discovers that the woman is missing. He goes to the police station, but Detective Lynn Hadley does not give much attention to him and discredits his statement. Leon becomes obsessed to find what happened with the stranger and he watches the subway station. When he sees the elegant butcher Mahogany in the train, Leon believes he might be a murderer and stalks him everywhere, in the beginning of his journey to the darkness.",2008-08-07,English,98
84985,The Magus,"Mystery,Drama,Fantasy","Michael Caine,Anthony Quinn,Candice Bergen,Anna Karina",Guy Green,/jj0rjPeUrcsoVMWW2WJg1qFscB2.jpg,A teacher on a Greek island becomes involved in bizarre mind-games with the island's magus (magician) and a beautiful young woman.,1968-12-10,English,117
169178,Clarisse or Something About Us,"Mystery,Drama,Fantasy,Horror","Sabrina Greve,Everaldo Pontes,Veronica Cavalcanti,David Wendefilm,Débora Ingrid,Tabata Nery",Petrus Cariry,/u2boCxYbBJzkpiq8S0y52YsNvUu.jpg,"The dry quarry and a forest that still beats. A very sick father reviews the daughter. Resentments are brought to the table. The memory of the dead awakened by blood, objects, shadows and dreams affects Clarisse at this scenario of beauty and agony. Husband and business are expecting she in the city for a cathartic outcome.",2015-10-30,Português,84
124781,Marianne,"Mystery,Drama,Fantasy,Horror,Thriller","Thomas Hedengran,Peter Stormare,Tintin Anderzon,Sandra Larsson,Dylan M. Johansson,Viktoria Sätter,Helena Löwenmark",Filip Tegstedt,/fteIhISB1UvL4oEFxaq5UX0CFNe.jpg,"The life of Krister has become an unending nightmare, ever since his wife's death. There seems to be no respite for this man, tormented by the errors of his past and held prisoner by a grim daily existence.",2011-11-04,svenska,103
72906,Not Reconciled,"Mystery,Drama,History",,Jean-Marie Straub,/ys6DIc2TWRhurrPmZN23EEQZXEX.jpg,"Not Reconciled, the title of the Straubs’ first feature-length film, is engraved on their work like an inscription. It is a story about the continuity and collapse of history, the power of suppression, and the terror of reconciliation; loyalty, treason and revenge. In a brave cinematic game, Heinrich Böll’s story Billiards at Half-Past Nine is split up into cracks, blocks, breaks and sudden turns, as the life story of a German family, covering numerous generations, is propelled forward. Terms such as “interwar period” and “post-war period” are blown up with a single cut, word or click of a billiard ball. Not Reconciled remains one of the most important German film of the past fifty years.",1965-07-04,Deutsch,55
182775,Maze,"Mystery,Drama,History,Crime,Adventure,Thriller","Tom Vaughan-Lawlor,Barry Ward,Martin McCann,Niamh McGrady,Eileen Walsh,Aaron Monaghan,Ross McKinney,Elva Trill,Tim Creed,Cillian O'Sullivan,Patrick Buchanan,Andy Kellegher,David Coakley,Will Irvine,Lalor Roddy",Stephen Burke,/bWEF3a1qErRIjmLW0xU28zAgV9D.jpg,"Inspired by the true events of the infamous 1983 prison breakout of 38 IRA prisoners from HMP Maze, which was to become the biggest prison escape in Europe since World War II.",2017-09-22,English,93
144700,The Cokeville Miracle,"Mystery,Drama,History,Family,Thriller","Nathan Stevens,Jasen Wade,Caitlin E.J. Meyer,Mason D. Davis,Joshua Cooper,Paul D. Hunt,Anson Bagley",T.C. Christensen,/sBstUVhHeD9WN1SPeU0dHrNmwfC.jpg,"On May 9, 1986, a small ranching community in Wyoming experiences a divine intervention when a couple detonates a bomb inside a crowded classroom.",2015-06-05,English,94
5930,Brimstone & Treacle,"Mystery,Drama,Horror","Sting,Denholm Elliott,Joan Plowright,Suzanna Hamilton,Benjamin Whitrow,Dudley Sutton,Mary MacLeod,Tim Preece,Elizabeth Bradley,Hugh Walters,Christopher Fairbank",Richard Loncraine,/zU5MYU4kNNau04kvJD7Ezq2lGDZ.jpg,A strange young man has a sinister effect on the family of a middle-aged writer.,1982-10-01,English,87
27317,Audition,"Mystery,Drama,Horror,Thriller","Ryo Ishibashi,Eihi Shiina,Jun Kunimura,Tetsu Sawaki,Renji Ishibashi,Miyuki Matsuda,Toshie Negishi,Shigeru Saiki,Ken Mitsuishi,Yuriko Hiro'oka,Ren Osugi,Kanji Tsuda,Fumiyo Kohinata,Tomomi Maruyama",Takashi Miike,/mrK8hwRqaR1lveGoIcBICBqdmTG.jpg,"Seven years after the death of his wife, company executive Aoyama is invited to sit in on auditions for an actress. Leafing through the resumés in advance, his eye is caught by Yamazaki Asami, a striking young woman with ballet training.",1999-10-06,日本語,115
3457,Waking the Dead,"Mystery,Drama,Romance","Billy Crudup,Jennifer Connelly,Paul Hipp,Hal Holbrook,Ivonne Coll,Lawrence Dane,Ed Harris,Janet McTeer,Molly Parker,Larry Marshall,Stanley Anderson,Bruce Dinsmore,Mimi Kuzyk,Sandra Oh",Keith Gordon,/8tPS6UXtEDAHqzt6WtLG7k3rpzq.jpg,"A congressional candidate questions his sanity after seeing the love of his life, presumed dead, suddenly emerge.",2000-03-23,English,105
26170,The Bride Wore Black,"Mystery,Drama,Romance,Thriller,Crime","Jeanne Moreau,Michel Bouquet,Jean-Claude Brialy,Charles Denner,Claude Rich,Michael Lonsdale,Daniel Boulanger,Alexandra Stewart,Sylvine Delannoy,Luce Fabiole,Michèle Montfort,Paul Pavel,Serge Rousseau,Van Doude,Christophe Bruno,Jacques Robiolles,Gilles Quéant,Daniel Pommereulle",François Truffaut,/iDj7QFYq9YfmUVc1ALanQmYfTaj.jpg,"Julie Kohler is prevented from suicide by her mother. She leaves the town. She will track down, charm and kill five men who do not know her. What is her goal ? What is her purpose?",1968-04-17,Français,107
4625,Millennium,"Mystery,Drama,Science Fiction,Thriller","Kris Kristofferson,Cheryl Ladd,Daniel J. Travanti,Robert Joy,Lloyd Bochner,Brent Carver,David McIlwraith,Maury Chaykin,Al Waxman,Lawrence Dane,Thomas Hauff,Peter Dvorsky,Raymond O'Neill,Philip Akin,David Calderisi,Gary Reineke,Eugene Clark,Cedric Smith,Michael J. Reynolds,Victoria Snow,Scott Thompson",Michael Anderson,/ll2YocDnf0zd1c0LvjlSJCILtIF.jpg,An investigator seeking the cause of an airline disaster discovers the involvement of an organisation of time travellers from a future Earth irreparably polluted who seek to rejuvenate the human race from those about to die in the past. Based on a novel by John Varley.,1989-08-25,English,108
1921,Pi,"Mystery,Drama,Thriller","Sean Gullette,Mark Margolis,Ben Shenkman,Samia Shoaib,Pamela Hart,Ajay Naidu,Joanne Gordon,Stephen Pearlman,Kristyn Mae-Anne Lao,Lauren Fox,Clint Mansell,Espher Lao Nieves,Stanley B. Herman,Oren Sarch,Abraham Aronofsky",Darren Aronofsky,/d4pDorUHjIVFiVGiJar6sF2r8TQ.jpg,The debut film from Darren Aronofsky in which a mathematical genius Maximilian Cohen discovers a link in the connection between numbers and reality and thus believes he can predict the future.,1998-07-10,English,84
7382,I'm Not Scared,"Mystery,Drama,Thriller,Crime","Giuseppe Cristiano,Dino Abbrescia,Aitana Sánchez-Gijón,Diego Abatantuono,Fabio Tetta,Riccardo Zinna,Giulia Matturro,Antonella Stefanucci,Fabio Antonacci,Giorgio Careccia,Mattia Di Pierro,Stefano Biase,Adriana Conserva,Michele Vasca,Susi Sánchez",Gabriele Salvatores,/aNWNAwuGmTkRdVF9tg5RA0UssWo.jpg,"While playing outside one day, nine-year-old Michele discovers Filippo, who is chained to the ground at the bottom of a hole. Michele witnesses town baddie Felice nearby and suspects something bad is happening. Michele is unsure whom he should tell about his discovery, eventually spilling the beans to his closest friend. Michele's parents learn of his discovery and warn him to forget what he saw",2003-02-08,Italiano,108
80825,Shadows,"Mystery,Drama,Thriller,Horror","Borce Nacev,Vesna Stanojevska,Sabina Ajrula,Salaetin Bilal,Ratka Radmanovic,Filareta Atanasova,Dimitar Gjorgjievski",Milčo Mančevski,/qk89sb5Kyyq4MvmCdMNqwwwTWQA.jpg,"A successful young doctor with a beautiful wife, a happy child, and a comfortable house finds his life suddenly changed in ways he never thought possible after being injured in a serious car accident. To the outside eye Lazar Perkov has everything -- indeed his friends and colleagues have even gone so far as to christen him with the nickname ""Lucky."" But appearances can sometimes be...",2007-06-06,,120
5316,Enigma,"Mystery,Drama,Thriller,Romance,War","Dougray Scott,Kate Winslet,Saffron Burrows,Jeremy Northam,Nikolaj Coster-Waldau,Tom Hollander,Donald Sumpter,Matthew Macfadyen,Richard Leaf,Bohdan Poraj,Paul Rattray,Tom Fisher,Robert Pugh,Corin Redgrave,Nicholas Rowe,Angus MacInnes,Michael Troughton,Edward Hardwicke,Anne-Marie Duff,Tim Bentinck,Mary MacLeod,Rosie Thomson,Richard Katz,Emma Davies",Michael Apted,/xBRgHFHnCqhfpq4w63XqbjdMdB2.jpg,"A romantic thriller based around the World War 2 project to crack the codes behind the Enigma machine, used by the Germans to encrypt messages sent to their submarines.",2001-01-22,"Deutsch,English",119
188741,The Suspicions of Mr Whicher: The Murder in Angel Lane,"Mystery,Drama,TV Movie","Paddy Considine,Olivia Colman,Paul Longley,Andy Gathergood,William Beck,James Wilson",Christopher Menaul,/3fgW2Ufr7Y7B86bteC9leght9Y6.jpg,"Whicher,retired from the police after his failure to solve the Road Hill House case,encounters Susan Spencer in a rough tavern,seeking her niece Mary,who came to London to find Stephen Gann,father of her baby. Soon afterwards Mary is found slain and the child missing and Whicher offers to help Susan find the killer. The baby is located at a home for unwed mothers,run by Reverend Marlow,who believes Mary went after Stephen,who rejected her. Whicher learns that Stephen's father was hung for murdering Susan's father though Mary knew nothing about it. Stephen and an opportunistic thief are the main murder suspects but Stephen convinces Whicher that he was the intended victim as he was about to hear important news from his grandfather Joshua,now in an insane asylum. Whicher inveigles his way into the asylum to speak to Joshua and,in solving the case,uncovers dark secrets in the Gann and Spencer families as well as betrayal by a corrupt policeman.",2013-05-11,English,95
26822,The Puppetmaster,"Mystery,Drama,War","Li Tian-Lu,Lim Giong,Ming Hwa Bai,Fue Choung Cheng,Tsai Chen-Nan,Yang Li-Yin",Hou Hsiao-hsien,/jL7aGXVXyui1VLRnAXIi4LjcoaZ.jpg,"In the first half of this century, young Li Tienlu joins a travelling puppet theatre and subsequently makes a career as one of Taiwan's leading puppeteers.",1993-09-13,"日本語,普通话",142
170975,The Ten Lives of Titanic the Cat,"Mystery,Family","Tiril Eeg-Henriksen,Martin Mbugua,Christian Skolmen,Anne Ryg,Cecilie A. Mosli,Sossen Krohg,Edvard Løvold Gaukstad,Shabana Rehman,Yngve Berven,Inger Dietrichs,Ulla Marie Broch,Gard B. Eidsvold,Ragni Flagstad Kristiansen,Siri Lill Mannes",Grethe Bøe-Waal,/zJBSNGDMzL3EvQjuEzYqU0fB186.jpg,A young girl finds her excitement over the prospect of an ocean cruise suddenly offset by a series of bizarre visions.,2007-10-31,Norsk,74
149826,Secret Society of Souptown,"Mystery,Family,Adventure,Fantasy","Olivia Viikant,Karl Jakob Vibur,Hugo Soosaar,Arabella Antons,Mirtel Pohla,Evelin Võigemast,Ott Aardam,Tiit Lilleorg,Sten-Markus Rohtla,Gregor Kelder,Meriliis Lillemägi,Sampo Sarkola",Margus Paju,/jA9Jst8Jwa3uArDau9uvmgYmxXW.jpg,"""Secret Society of Souptown"" is an adventurous family movie that takes place in Souptown, a district in the summery city of Tartu. Four children - Mari, Sadu, Olav and Anton form a secret society to play hide-and seek games invented by Mari's grandfather, a professor at the university. When the city is attacked by a mysterious poison which turns adults into children our gang embarks on a quest for the antidote. Their path is paved with challenges bigger than any other they have seen so far. It is an adventure you cannot even imagine... Will the children find the antidote in time to save their loved ones.",2015-05-15,Eesti,105
