movieId,title,genres,actors,directors,posterPath,plotSummary,releaseDate,languages,runtime
1181,The Shooter,Western,"Michael Dudikoff,Randy Travis,Valerie Wildman,Andrew Stevens,William Smith,Libby George",Fred Olen Ray,/3po7OVdCPVwGopM7HgIGFvZsYU8.jpg,"The story is of a small town in the early west and of a 'shooter' of reputation that drifts into it and stands up to the controlling family that runs it. But far from a John Wayne, this hero is caught and brutally beaten and left to die, only to be saved by a prostitute that has also suffered under the hand of this group of desperados. The only one possible to stand up to the shooter is another solitary man who joins with the notorious family although he is deputized as the town's sherif.",1997-10-23,English,91
5063,One-Eyed Jacks,"Western,Action","Marlon Brando,Karl Malden,Katy Jurado,Pina Pellicer,Ben Johnson,Slim Pickens,Larry Duran,Sam Gilman,Timothy Carey,Miriam Colón,Elisha Cook Jr.,Rodolfo Acosta,Ray Teal,Hank Worden,John George",Marlon Brando,/8fwKm8kH9OtOjYjyF6Sy2MrjcWl.jpg,"Running from the law after a bank robbery in Mexico, Dad Longworth finds an opportunity to take the stolen gold and leave his partner Rio to be captured. Years later, Rio escapes from the prison where he has been since, and hunts down Dad for revenge. Dad is now a respectable sheriff in California, and has been living in fear of Rio's return.",1961-03-30,"English,Español",141
124408,Last of the Comanches,"Western,Action,Adventure","Broderick Crawford,Barbara Hale,Johnny Stewart,Lloyd Bridges,Mickey Shaughnessy,George Mathews,Hugh Sanders,Ric Roman,Chubby Johnson,Martin Milner,Milton Parsons,Jack Woody,John War Eagle,George Chesebro,Steve Forrest,Harry Harvey,Jay Silverheels,Carleton Young",André De Toth,/oslcjHTz5TBNUuT3uLhhCmG1uXu.jpg,"It's 1876 and all the Indians are at peace except the Comanches lead by Black Cloud. When Black Cloud wipes out a town, only six soldiers are left and they head for the nearest fort. In the desert they are reinforced by members of a stagecoach and find some water at a deserted mission. Pinned down by Black Cloud they send an Indian boy who was Black Cloud's prisoner on to the fort while they try to bargain with Black Cloud whom they learn is without water.",1953-02-01,English,85
84643,Allegheny Uprising,"Western,Action,Adventure,History","Claire Trevor,John Wayne,George Sanders,Brian Donlevy,Wilfrid Lawson,Robert Barrat,John F. Hamilton,Moroni Olsen,Eddie Quillan,Chill Wills,Ian Wolfe,Wallis Clark,Monte Montague,Olaf Hytten,Eddy Waller,Clay Clement,Earl Askam,Stanley Blystone,Horace B. Carpenter,Jess Cavin,Tom Coleman,Forrest Dillon,Jesse Graves,Lew Harvey,Leyland Hodgson,Noble Johnson,Carl Knowles,Ethan Laidlaw,Tom London,Robert McKenzie,Charles Middleton,Clive Morgan,Jack O'Shea,Bud Osborne,Douglas Spencer",William A. Seiter,/pRoEkLibJvmSqVEKR33tV2aPicI.jpg,"Allegheny Uprising is a 1939 film produced by RKO Pictures, starring Claire Trevor and John Wayne as pioneers of early American expansion in south central Pennsylvania. Clad in buckskin and a coonskin cap (as he would be a decade later in The Fighting Kentuckian), Wayne plays real-life James Smith, an American coping with British rule in colonial America. The film is loosely based on a historical event known as the Black Boys Rebellion during the 1760s.",1939-11-10,English,81
68855,Montana,"Western,Action,Adventure,Romance","Errol Flynn,Alexis Smith,S.Z. Sakall,Douglas Kennedy,James Brown,Ian MacDonald,Charles Irwin,Paul E. Burns,Tudor Owen,Lester Matthews","Ray Enright,Raoul Walsh",/7X0nX6tMHyobz4A6R5D82htaTkZ.jpg,"An Australian sheep man comes to Montana looking for grazing space, is opposed by local ranchers and a wealthy cattle-woman.",1950-01-28,English,76
438,The Cowboy Way,"Western,Action,Comedy","Woody Harrelson,Kiefer Sutherland,Dylan McDermott,Ernie Hudson,Marg Helgenberger,Luis Guzmán,Angel Caban,Joaquin Martinez,Tomás Milián,Cara Buono,Allison Janney",Gregg Champion,/dNyAx7mCOz69QtNObLKC2gw9f1p.jpg,"Two championship rodeo partners travel to New York to find their missing friend, Nacho Salazar who went missing there.",1994-06-03,English,102
4696,"Zorro, The Gay Blade","Western,Action,Comedy,Adventure,Romance","George Hamilton,Lauren Hutton,Brenda Vaccaro,Ron Leibman,Donovan Scott,James Booth,Helen Burns",Peter Medak,/7qO9lyAVkFRSvKm5ESVwiGTJtm7.jpg,"George Hamilton stars in a dueling dual role as twin sons of the legendary Zorro. Soon after the dashing Don Diego Vega inherits his father's famous sword and costume, a broken ankle prevents the masked avenger from fulfilling his heroic duties. When his flamboyantly fashion-conscious brother assumes the secret identity to continue an ongoing fight for justice, the results are nothing short of hilarious!",1981-07-17,English,93
147528,Dead Man's Revenge,"Western,Action,Crime","Bruce Dern,Michael Ironside,Vondie Curtis-Hall,Keith Coulouris,Daphne Ashbrook,Tobin Bell,John M. Jackson,Melora Walters,Jack Rader,Doug McClure,Randy Travis",Alan J. Levi,/ntegi5O44QUzPse5qg6EiE1nJcL.jpg,"Bitter and vengeful fugitive Luck Hatcher, dignified former slave turned bounty hunter Jessup Bush, and wily deputy U.S. Marshal Bodine all converge in a small town so they can hatch an intricate con in order to bring greedy and ruthless railroad speculator Payton McCay to justice.",1994-04-15,English,100
110399,Boots and Saddles,"Western,Action,Drama","Gene Autry,Smiley Burnette,Judith Allen,Ronald Sinclair,Guy Usher,Bill Elliott,Frankie Marvin,Chris-Pin Martin,Stanley Blystone,Bud Osborne,John Ward",Joseph Kane,/axl4gtgvWgqnPfBkv7PgKDyc8yy.jpg,"Young Englishman inherits ranch which he wants to sell, but Gene's gonna turn him into a real westerner instead. When new owner Spud arrives from England, Autry convinces him not to sell the ranch but to raise horses for the Army. When both Autry's and Neale's bids are the same, the Colonel calls for a race to decide the winner. But that night Neale has Autry's stable burned.",1937-10-04,English,58
116553,The Desperate Trail,"Western,Action,Drama,Crime","Sam Elliott,Craig Sheffer,Linda Fiorentino,Frank Whaley,John Furlong,John Furlong,Bradley Whitford",P.J. Pesce,/1wH2QZv3aTBOmM7DMhpu1qK0pNp.jpg,"Amiable con man Jack Cooper is on a westbound stagecoach, headed for the next batch of suckers who will mistake him for an easy mark. Fiery Sarah O'Rourke rides the same coach, handcuffed to lawman Bill Speakes and headed for the hangman. In a few hours, all should reach their destinations. But the trail they travel takes an unexpected turn: Cooper and O'Rourke are soon off the stage and running for their lives. The law ends and the chase begins in a very alive tale of wanted-dead-or-alive fugitives (Linda Fiorentino and Craig Sheffer) pursued by a marshal (Sam Elliott) who's a law unto himself.",1995-07-09,"English,Español",96
2235,One Man's Hero,"Western,Action,Drama,History","Tom Berenger,Joaquim de Almeida,Daniela Romo,Mark Moses,Stuart Graham,Gregg Fitzgerald,Don Wycherley,Wolf Muser,Luke Hayden,Ilia Volok,Patrick Bergin,James Gammon,Carlos Carrasco,Stephen Tobolowsky,Dermot Martin",Lance Hool,/vgvVNmCybkmOtaSXpSG7aONQrJ2.jpg,"One Man's Hero tells the little-known story of the ""St. Patrick's Battalion"" or ""San Patricios,"" a group of mostly Irish and other immigrants of the Catholic faith who deserted to Mexico after encountering religious and ethnic prejudice in the U.S. Army during the Mexican-American War. The plot centers around the personal story of John Riley, an Irishman who had been a sergeant in the American Army who is commissioned as a captain in the Mexican army and commands the battalion, as he leads his men in battle and struggles with authorities on both sides of the border",1999-08-02,English,121
115235,Young Ones,"Western,Action,Drama,Science Fiction","Michael Shannon,Nicholas Hoult,Elle Fanning,Kodi Smit-McPhee,Aimee Mullins,Christy Pankhurst,Alex McGregor,Robert Hobbs,David Butler,David Clatworthy,Liah O'Prey,Carel Nel,Gideon van Schoor,Andy McPhee,Benny Horowitz,Rachel Wood,Charles Tertiens,Vlam Beukes,Barry Armitage,Karen Snyman",Jake Paltrow,/kCTYduARud4wGjv6sracsqsbDtq.jpg,"In a future where water is scarce, a farmer defends his land and hopes to rejuvenate his parched soil. However, his daughter's boyfriend schemes to steal the land for himself.",2014-06-28,English,100
168190,Journey to Shiloh,"Western,Action,Drama,War","James Caan,Michael Sarrazin,Brenda Scott,Don Stroud,Paul Petersen,Michael Burns,Jan-Michael Vincent,John Doucette,Noah Beery, Jr.,Tisha Sterling,James Gammon,Brian Avery,Harrison Ford",William Hale,/ntEWIKsdOoxktJq8f8Dk55eRvIv.jpg,"At the beginning of the Civil War, seven friends embark on a cross-country journey in order to join the Confederate army.",1968-04-25,English,101
115921,Dead in Tombstone,"Western,Action,Fantasy,Horror","Danny Trejo,Mickey Rourke,Anthony Michael Hall,Dina Meyer,Richard Dillane,Ronan Summers,James Carroll Jordan,Catalina Grama,Edward Akrout,Dan Badarau,Colin Mace,Emil Hostina,Ovidiu Niculescu,Radu Andrei Micu,Daniel Lapaine,George Remes,Ioan Cortea,Tomi Cristin,Corneliu Ulici,Claudiu Trandafir,Radu Iacoban,Daniel Pisica,Miriam Rizea,Constantin Barbulescu,Mike Elliott,Ioan Ionescu,Răzvan Oprea,Marius Capota,Ornella Boulé,Sandy Romero",Roel Reiné,/esk9F3hBlNYsUk9koPrOyfYlLaB.jpg,"An outlaw named Guerrero Hernandez is shot in the back and killed whilst attempting to free his half-brother from a small-town prison. Making a deal with the devil, Hernandez returns from the dead to take his revenge.",2013-10-01,English,100
123095,Left for Dead,"Western,Action,Horror","Victoria Maurette,Mariana Seligmann,Andres Bagg,María Alché,Javier De la Vega,Janet Bar,Soledad Arocena,Adnen Helali,Oliver Kolker,Brad Krupsaw",Albert Pyun,/6ZrphdxlM6AGIxfYg3WrnO2AIBl.jpg,"Set in Mexico, Left For Dead is a bloody and sick dream ... A spaghetti western in terror. A desperate criminal will be caught in the ghost town of Amnesty alongside a vengeful demon ...",2007-03-04,English,84
91031,Wichita,"Western,Action,Romance","Joel McCrea,Vera Miles,Lloyd Bridges,Wallace Ford,Jack Elam,Edgar Buchanan,Peter Graves,Keith Larsen,Carl Benton Reid,John Smith,Walter Coy,Robert J. Wilke,Mae Clarke,Walter Sande",Jacques Tourneur,/wUPhJkTgTnYlU83JHIKTrUIvQkF.jpg,Former buffalo hunter and entrepreneur Wyatt Earp arrives in the lawless cattle town of Wichita Kansas. His skill as a gun-fighter make him a perfect candidate for Marshal but he refuses the job until he feels morally obligated to bring law and order to this wild town.,1955-07-03,English,81
162788,"Aliens in the Wild, Wild West","Western,Action,Science Fiction","Taylor Locke,Carly Pope,Barna Moricz,Markus Parilo",George Erschbamer,/ybq7IoQ28UybkmzKyL7M18ChaNI.jpg,"When a UFO crash lands nearby, it's up to a couple of kids to save the aliens from the local townspeople.",1999-08-17,English,90
143259,4Got10,"Western,Action,Thriller","Dolph Lundgren,Danny Trejo,Johnny Messner,Vivica A. Fox,Michael Paré,Stefania Spampinato,Erin O'Brien,Natassia Malthe,John Laughlin,Angell Conwell",Timothy Woodward Jr.,/b2lhUuG95CZbZ36CX6il0jCCobA.jpg,"Brian Barnes (Johnny Messner) wakes up in the desert wounded and with no memory and no idea why he's surrounded by eight bodies, a van with four million in cash and a van full of cocaine. Brian is pursued by not only notorious drug lord Danny Perez (Danny Trejo) who desperately want his money back, and DEA Agent Rooker (Dolph Lundgren), but also a by the corrupt Sheriff Olson (Michael Pare) who will stop at nothing to get his hand on the new found fortune. On the run, Brian discovers the more he remembers the less he wants to know about who he really is.",2015-09-11,English,84
100042,The Guns Of Fort Petticoat,"Western,Action,War","Audie Murphy,Kathryn Grant,Patricia Tiernan,Ray Teal,Jeanette Nolan,James Griffith,Hope Emerson,Jeff Donnell,Sean McClory,Nestor Paiva",George Marshall,/cbxSFUz2HQ2M2DCP5MLhm2Q5MQu.jpg,"Opposing his commanding officer's decision to attack a group of innocent Indians and wipe them out, Lt. Frank Hewitt leaves his post and heads home to Texas. He knows that the attack will send all of the tribes on the warpath and he wants to forewarn everyone. He gets a chilly reception back home however. With most of the men away having enlisted in the Confederate army Frank, a Union officer, is seen by the local women as a traitor. He convinces them of the danger that lies ahead and trains them to repel the attack that will eventually come.",1957-04-01,English,82
124877,Thunder Over the Plains,"Western,Action,War,Romance","Randolph Scott,Lex Barker,Phyllis Kirk,Charles McGraw,Henry Hull,Elisha Cook Jr.,Fess Parker,Hugh Sanders,Lane Chandler,James Brown,Mark Dana",André De Toth,/iZhNHGIpKEtKYvGTQMBkFFkdjqH.jpg,"Set in 1869, after the Civil War, Texas had not yet been readmitted to the Union and carpetbaggers, hiding behind the legal protection of the Union Army of occupation, had taken over the state. Federal Captain Porter (Randolph Scott), a Texan, has to carry out orders against his own people. He brings in the rebel leader Ben Westman, (Charles McGraw), whom he knows is innocent of a murder that he is accused of. In trying to prove his innocence, Porter himself becomes a wanted man.",1953-10-27,English,82
1379,Young Guns II,"Western,Adventure","Emilio Estevez,Kiefer Sutherland,Lou Diamond Phillips,Christian Slater,William Petersen,Alan Ruck,R. D. Call,Balthazar Getty,Jack Kehoe,Robert Knepper,Tom Kurlander,Viggo Mortensen,Leon Rippy,Tracey Walter,Bradley Whitford,Scott Wilson,James Coburn,Jenny Wright,Mickie McGowan",Geoff Murphy,/wlHmBfL43UvVILBmBsYvtizmueM.jpg,"Only three of the original five ""young guns"" -- Billy the Kid (Emilio Estevez), Jose Chavez y Chavez (Lou Diamond Phillips), and Doc Scurlock (Kiefer Sutherland) -- return in Young Guns, Part 2, which is the story of Billy the Kid and his race to safety in Old Mexico while being trailed by a group of government agents led by Pat Garrett",1990-08-01,English,132
145440,"Holy God, Here Comes the Passatore!","Western,Adventure,Comedy","George Hilton,Edwige Fenech,Manuel Zarzo,Salvatore Borghese,Chris Avram,Cris Huerta,Helga Liné,Fortunato Arena,Jack Logan,Lucretia Love,Dante Cleri",Giuliano Carnimeo,/uVoeCMW8N6pSYsViH7GDOwbNTCr.jpg,"George Hilton is the infamous highway robber Stefano Pelloni, known as Il Passatore and Edwige Fenech is his opinionated leading lady, Mora, in this slapstick 'comedy'",1973-01-18,Italiano,93
59945,The Mark of Zorro,"Western,Adventure,Drama,Action,Romance","Douglas Fairbanks,Noah Beery,Charles Hill Mailes,Claire McDowell,Marguerite De La Motte,Robert McKim,George Periolat,Walt Whitman,Sidney De Gray,Tote Du Crow,Noah Beery, Jr.,Milton Berle",Fred Niblo,/3HPZeNUdKuLxPBNnD7SOb0URsc5.jpg,The adventures of the masked hero continues.,1920-12-05,,107
121543,White Fang and the Hunter,"Western,Adventure,Drama,Family","Robert Woods,Ignazio Spalla,Malisa Longo,Claudio Undari",Alfonso Brescia,/mQCOgQVoNWW6sODvwZhPssa5cnh.jpg,"Courageous Alaskan canine White Fang and Daniel, his fur-trapping master are beset by wolves and later help save a widow who is being forced to marry a man she despises.",1975-12-31,,91
107752,White Fang,"Western,Adventure,Family","Franco Nero,Virna Lisi,Fernando Rey,John Steiner,Raimund Harmstorf,Daniel Martín,Rik Battaglia,Daniele Dublino,Maurice Poli,John Bartha,Carole André",Lucio Fulci,/t7eTsHVIsQOoK7Yyz5D3G0LRtvI.jpg,"The wolf dog, White Fang, aids a reporter, a fur trapper, a nun, a young Eskimo boy and his father of ridding a gold mining town of a sleazy crime lord in 1896 Yukon, Canada.",1973-12-21,Italiano,102
63692,Don Q Son of Zorro,"Western,Adventure,Romance","Douglas Fairbanks,Mary Astor,Donald Crisp,Jack McDonald,Warner Oland,Stella De Lanti,Jean Hersholt",Donald Crisp,/wClPdB9IrXRwmUm4sw5XKIgBa34.jpg,"Returning to the legend that inspired his first swashbuckling adventure, Fairbanks appeared in DON Q, SON OF ZORRO. Don Cesar De Vega (Fairbanks) crosses swords with a vicious member of the Queen's Guard (Donald Crisp, who also directed), and steals the affection of a young heiress (Mary Astor). When the officer frames the young upstart for murder, Don Cesar fakes his own death and retreats to the crumbling ruins of the family castle he plots his vengeance.",1925-06-15,English,111
5389,Spirit: Stallion of the Cimarron,"Western,Animation,Adventure,Comedy,Family","Matt Damon,James Cromwell,Daniel Studi,Chopper Bernet,Jeff LeBeau,John Rubano,Richard McGonagle,Matt Levin,Adam Paul,Robert Cait,Charles Napier,Meredith Wells,Zahn McClarnon,Michael Horse,Donald Fullilove","Kelly Asbury,Lorna Cook",/7cfXsSe621cWpCpAuuJgud0Gszt.jpg,"As a wild stallion travels across the frontiers of the Old West, he befriends a young human and finds true love with a mare.",2002-05-24,English,83
3671,Blazing Saddles,"Western,Comedy","Cleavon Little,Gene Wilder,Harvey Korman,Slim Pickens,Madeline Kahn,Mel Brooks,Dom DeLuise,Liam Dunn,George Furth,Burton Gilliam,John Hillerman,Alex Karras,David Huddleston,Carol Arthur,Richard Collier,Charles McGregor,Don Megowan,Count Basie,Karl Lukas,Robyn Hilton,Jack Starrett,Rodney Allen Rippy,Robert Ridgely,Anne Bancroft,Ralph Manza",Mel Brooks,/yccgwPNVaqtgS1d0U5jjM6Mnza8.jpg,"A town – where everyone seems to be named Johnson – is in the way of the railroad and, in order to grab their land, Hedley Lemar, a politically connected nasty person, sends in his henchmen to make the town unlivable. After the sheriff is killed, the town demands a new sheriff from the Governor, so Hedley convinces him to send the town the first black sheriff in the west.",1974-02-07,"English,,Deutsch",93
118734,Zorro,"Western,Comedy,Action,Adventure","Alain Delon,Ottavia Piccolo,Moustache,Enzo Cerusico,Giampiero Albertini,Stanley Baker",Duccio Tessari,/s62BV8fQn7FR9G8K1P6sgh2obev.jpg,"A newly arrived governor finds his province under the control of the corrupt Colonel Huerta. To avoid assassination by Huerta, he pretends to be weak and indecisive so Huerta will believe he poses no threat. But secretly he masquerades as Zorro, and joins the monk Francisco and the beautiful aristocrat Hortensia in their fight for justice against Huerta and his soldiers.",1975-03-06,Italiano,124
123510,Honky Tonk,"Western,Comedy,Crime,Drama","Clark Gable,Lana Turner,Frank Morgan,Claire Trevor,Marjorie Main,Albert Dekker,Henry O'Neill,Chill Wills,Veda Ann Borg,Douglas Wood,Lew Harvey,Betty Blythe,Harry Worth,Erville Alderson,Demetrius Alexis,Hooper Atchley,Dorothy Ates,King Baggot,Don Barclay,Jack Baxley,Barbara Bedford,Ed Brady,Al Bridge,Francis X. Bushman Jr.,Jack Carr,Ed Cassidy,Tom Chatterton,Cliff Clark,Heinie Conklin,Tommy Conlon,Dick Curtis,Sheila Darcy,Gordon De Main,Joe Devlin,John Farrell,Harry Fleischmann,Bess Flowers,Dorothy Granger,Earl Gunn,William Haade,Eddie Hall,Edward Hearn,Al Hill,Fay Holderness,Robert Homans,Payne B. Johnson,Jane Keckley,Lew Kelly,Cy Kendall,Milton Kibbee,George Lehrer,Mitchell Lewis,Louis Mason,John Maxwell,Charles McAvoy,Art Miles,Frank Mills,Howard M. Mitchell,Monte Montague,Philip Morris,Esther Muir,Horace Murphy,Paul Newlan,Frank O'Connor,Pat O'Malley,Anne O'Neal,Ted Oliver,William Pagan,Lee Phelps,Alonzo Price,Henry Roquemore,Dick Rush,John Sheehan,Lee Shumway,Philip Sleeman,Jack C. Smith,Carl Stockdale,Charles Sullivan,Elliott Sullivan,Ray Teal,William Telaak,Malcolm Waite,Morgan Wallace,Eddy Waller,Harry Wilson,Will Wright",Jack Conway,/9v8RYmENj50XHTEDBbNUvugZkOk.jpg,"Fast-talking con-man and grifter Candy Johnson rises to be the corrupt boss of Yellow Creek, but his wife's alcoholic father tries to set things right.",1941-10-01,English,105
121432,The Man Who Shook the Hand of Vicente Fernandez,"Western,Comedy,Drama","Ernest Borgnine,Barry Corbin,Carla Ortiz,Arturo del Puerto,June Squibb,Tony Plana,Dale Dickey,Audrey P. Scott,Reynaldo Pacheco,Ashley Holliday,Nathalie Kelley",Elia Petridis,/1suJt7I7ucbpadQipuRh67Xzp8u.jpg,"Rex is an old man who is bitter about never becoming famous and having lived a life without any meaning. After suffering a stroke, he ends up in a nursing home staffed by Latin American immigrants. Put off by the situation, he focuses his energy on getting out, which places him at odds with the Latino workers. However, their relationship takes on new meaning when it is discovered that he once shook hands with Vicente Fernandez, a Mexican singer, producer and actor idolized throughout Latin culture. The employees soon begin to treat Rex like the celebrity he's always dreamed of being.",2012-04-27,English,99
174507,Scandalous John,"Western,Comedy,Drama,Family","Brian Keith,Alfonso Aráu,Michele Carey,Rick Lenz,Harry Morgan,Simon Oakland,Bruce Glover",Robert Butler,/8KbITraPK0evQWPvrji0obNhmRB.jpg,"A crotchety old ranch owner fights to be able to live his life the way he wants to, and not the way other people--and the law--tell him he has to.",1971-06-22,English,113
6084,Honkytonk Man,"Western,Comedy,Drama,Music","Clint Eastwood,Kyle Eastwood,John McIntire,Alexa Kenin,Verna Bloom,Matt Clark,Barry Corbin,Jerry Hardin,Tim Thomerson,Macon McCalman,Joe Regalbuto,Gary Grubbs,Rebecca Clemons,Johnny Gimble,Linda Hopkins,Bette Ford",Clint Eastwood,/7kCPvBNgpb1qAcmEpj1q17ySbcO.jpg,Young boy leaves the Oklahoma farm to travel with his country musician uncle who is trying out for the Grand Ole Opry. Set during the Great Depression.,1982-12-15,English,122
178831,Go West,"Western,Comedy,Drama,War","Mario Drmac,Tarik Filipović,Rade Serbedzija,Jeanne Moreau,Mirjana Karanović,Haris Burina,Nermin Tulić,Almedin Leleta,Almir Kurt,Milan Pavlović,Orijana Kunčić,Mirsad Zulić,Mihajlo Mrvaljević,Selma Muhedinović,Rade Čolović",Ahmed Imamović,/xG9Wncb521ILLbglWyB1nbGoKIn.jpg,"In the nineties the Yugoslavia Federation falls apart in bloody wars. Perpetual student Milan, a Serb from a patriarchal community and Kenan, a Muslim cellist, are a homosexual couple living in Sarajevo. Their lives, intimate and public, are shaken up by the aggression in Bosnia and Herzegovina, whose devastating consequences unfold in inter-ethnic hatred. Trapped in Sarajevo during the siege of the Serb forces, the lovers manage to flee to Milan's home village and there they take shelter, waiting for Milan's father, Ljubo, to find a way to the Netherlands. Witnessing the brutality of Serb forces and their hatred towards Muslims, Milan desperately improvises: he disguises Kenan as a woman and begins to present him as his wife, Milena, a secret discovered by Milan's best friend, Lunja. Milan is drafted into the army and the situation becomes almost unbearable for Kenan. His one companion, is Ranka, a waitress in a local café, a woman whose dark secrets terrify most of the villagers ...",2005-08-18,"Bosanski,Français,Srpski",96
91163,Moonlight and Cactus,"Western,Comedy,Music","Patty Andrews,Maxene Andrews,Laverne Andrews,Leo Carrillo,Elyse Knox,Tom Seidel,Shemp Howard,Eddie Quillan,Murray Alper,Tom Kennedy,Frank Lackteen,Chatita Tovar,Minerva Urecal,Mitchell Ayres,Lollita Tovar,Jacqueline deWit,Mary O'Brien,Mady Correll",Edward F. Cline,/c02FCH9JXlACFdr6BfIbBqjmNKQ.jpg,The swinging Andrews Sisters provide the musical interludes and romance in this western. They play a trio of WW II era ranchers. That they are so good at running it proves terrible surprise for a ranch hand who has just returned home after serving in the Navy.,1944-09-08,,60
124113,The Kissing Bandit,"Western,Comedy,Music,Romance","Frank Sinatra,Kathryn Grayson,J. Carrol Naish,Mildred Natwick,Mikhail Rasumny,Billy Gilbert,Sono Osato,Clinton Sundberg,Carleton G. Young,Ricardo Montalban,Ann Miller,Cyd Charisse,Edna Skinner,Vicente Gómez",László Benedek,/6IOR10cunW7zFCqb5O0M1P8pUh7.jpg,"Ricardo, the milquetoast son of a Mexican bandit, would rather lead a quiet life in Boston. But the family would rather that he follow in his father's footsteps and become ""The Kissing Bandit"".",1948-11-14,English,100
68539,A Lady Takes a Chance,"Western,Comedy,Romance","Jean Arthur,John Wayne,Phil Silvers,Charles Winninger,Mary Field,Don Costello,John Philliber,Grady Sutton,Jean Stevens,Grant Withers,Hans Conried,Ariel Heath,Sugar Geise,Joan Blair,Tom Fadden,Eddy Waller,Nina Quartero,Alex Melesh,Cy Kendall,Paul Scott,Charles D. Brown,Billy Lenhart,Kenneth Brown,The Three Peppers,Polly Bailey,Bobby Barber,Benny Bartlett,Hank Bell,Joseph E. Bernard,Eddie Borden,Rudy Bowman,Roy Bucko,Fred Burns,Lane Chandler,Robert Cherry,J.W. Cody,Monte Collins,Armand Cortes,Victor Cox,Jack Daley,Roy Darmour,George DeNormand,Eddie Dew,Bert Dillard,Herbert Evans,George Ford,Bud Geary,Jack Gordon,Fred Graham,Dorothy Granger,Ralf Harolde,Warren Jackson,Ray Jones,Donald Kerr,Mike Lally,Frank McCarroll,Robert McKenzie,Dorcas McKim,Charles Meakin,Frank Melton,Kansas Moehring,Patsy Moran,Horace Murphy,Jack O'Shea,Artie Ortego,Ronald R. Rondell,Syd Saylor,Harry Semels,Allen D. Sewall,Mysty Shot,Clarence Straight,Chalky Williams,Hank Worden",William A. Seiter,/rB29SX4KYjHpWJmW48ZJVml9wWb.jpg,A city girl on a bus tour of the West encounters a handsome rodeo cowboy who helps her forget her simpy city suitors.,1943-08-19,English,86
114252,Thomasine & Bushrod,"Western,Crime,Action,Drama","Max Julien,Vonetta McGee,George Murdock,Glynn Turman,Juanita Moore,Joel Fluellen",Gordon Parks Jr.,/6um3WKHQnRlxRr9y4LQYPGTSbuQ.jpg,"A rare blaxploitation classic starring Vonette McGee &amp; Max Julien, Thomasine &amp; Bushrod was intended as a counterpart to Bonnie and Clyde. This pair of thieves, who operate in the American south between 1911 and 1915, pattern themselves after Robin Hood and hold the White Establishment as (a 'modern-day') Sheriff of Nottingham. Here's the clincher-- Thomasine and Bushrod steal from rich, white capitalists, then give to Mexicans, Native Americans and poor whites.",1974-04-10,English,95
